URL,Version,Status,OIDs,Name,Title,Descriptino,Uses,Used,Sources
http://cdc.gov/nchs/nvss/fhir/vital-records-messaging/ValueSet/Payload-version-vs,3.0.0-Preview1,draft,,PayloadVersionVS,Payload Version Identifier Values,"Payload Version Identifier Values","StructureDefinition/VRM-StatusParameters,StructureDefinition/VRM-VoidParameters,StructureDefinition/VRM-AliasParameters,StructureDefinition/VRM-MessageParameters","Internal"
http://cdc.gov/nchs/nvss/fhir/vital-records-messaging/ValueSet/VRM-AcknowledgementHeaderURI-vs,3.0.0-Preview1,draft,,AcknowledgementURIVS,Acknowledgement MessageHeader URI Values,"Acknowledgement MessageHeader URI Values","StructureDefinition/VRM-AcknowledgementHeader","Internal"
http://cdc.gov/nchs/nvss/fhir/vital-records-messaging/ValueSet/VRM-CauseOfDeathCodingHeaderURI-vs,3.0.0-Preview1,draft,,CauseOfDeathCodingURIVS,Cause of Death Coding MessageHeader URI Values,"Cause of Death Coding MessageHeader URI Values","StructureDefinition/VRM-CauseOfDeathCodingHeader","Internal"
http://cdc.gov/nchs/nvss/fhir/vital-records-messaging/ValueSet/VRM-CauseOfDeathCodingUpdateHeaderURI-vs,3.0.0-Preview1,draft,,CauseOfDeathCodingUpdateURIVS,Cause of Death Coding Update MessageHeader URI Values,"Cause of Death Coding Update MessageHeader URI Values","StructureDefinition/VRM-CauseOfDeathCodingUpdateHeader","Internal"
http://cdc.gov/nchs/nvss/fhir/vital-records-messaging/ValueSet/VRM-CertAvailable-vs,3.0.0-Preview1,draft,,CertAvailableVS,Certificate Available Values,"Certificate Available Values","StructureDefinition/VRM-birth-record-identifier-child,StructureDefinition/VRM-fetal-death-record-identifier","THO (V3),THO (V2)"
http://cdc.gov/nchs/nvss/fhir/vital-records-messaging/ValueSet/VRM-DemographicsCodingHeaderURI-vs,3.0.0-Preview1,draft,,DemographicsCodingHeaderURIVS,Demographics Coding  MessageHeader URI Values,"Demographics Coding  MessageHeader URI Values","StructureDefinition/VRM-DemographicsCodingHeader","Internal"
http://cdc.gov/nchs/nvss/fhir/vital-records-messaging/ValueSet/VRM-DemographicsCodingUpdateHeaderURI-vs,3.0.0-Preview1,draft,,DemographicsCodingUpdateHeaderURIVS,Demographics Coding Update MessageHeader URI Values,"Demographics Coding Update MessageHeader URI Values","StructureDefinition/VRM-DemographicsCodingUpdateHeader","Internal"
http://cdc.gov/nchs/nvss/fhir/vital-records-messaging/ValueSet/VRM-ExtractionErrorHeaderURI-vs,3.0.0-Preview1,draft,,ExtractionErrorHeaderURIVS,ExtractionError MessageHeader URI Values,"ExtractionError MessageHeader URI Values","StructureDefinition/VRM-ExtractionErrorHeader","Internal"
http://cdc.gov/nchs/nvss/fhir/vital-records-messaging/ValueSet/VRM-IndustryOccupationHeaderURI-vs,3.0.0-Preview1,draft,,IndustryOccupationURIVS,Industry and Occupation MessageHeader URI Values,"Industry and Occupation MessageHeader URI Values","StructureDefinition/VRM-IndustryOccupationCodingHeader","Internal"
http://cdc.gov/nchs/nvss/fhir/vital-records-messaging/ValueSet/VRM-IndustryOccupationUpdateHeaderURI-vs,3.0.0-Preview1,draft,,IndustryOccupationUpdateURIVS,Industry and Occupation Update MessageHeader URI Values,"Industry and Occupation Update MessageHeader URI Values","StructureDefinition/VRM-IndustryOccupationCodingUpdateHeader","Internal"
http://cdc.gov/nchs/nvss/fhir/vital-records-messaging/ValueSet/VRM-PregnancyOutcomes-vs,3.0.0-Preview1,draft,,PregnancyOutcomesVS,Pregnancy Outcome Values,"Pregnancy Outcome Values","StructureDefinition/VRM-RecentPregnancyParameters","THO (V3),SCT,Internal"
http://cdc.gov/nchs/nvss/fhir/vital-records-messaging/ValueSet/VRM-RequestHeaderURI-vs,3.0.0-Preview1,draft,,RequestURIVS,Request MessageHeader URI Values,"Request MessageHeader URI Values",,"Internal"
http://cdc.gov/nchs/nvss/fhir/vital-records-messaging/ValueSet/VRM-Status-vs,3.0.0-Preview1,draft,,StatusVS,Status Codes Values,"Status Codes Values","StructureDefinition/VRM-StatusParameters","Internal"
http://cdc.gov/nchs/nvss/fhir/vital-records-messaging/ValueSet/VRM-StatusHeaderURI-vs,3.0.0-Preview1,draft,,StatusURIVS,Status MessageHeader URI Values,"Status MessageHeader URI Values","StructureDefinition/VRM-StatusHeader","Internal"
http://cdc.gov/nchs/nvss/fhir/vital-records-messaging/ValueSet/VRM-SubmissionHeaderURI-vs,3.0.0-Preview1,draft,,SubmissionURIVS,Submission MessageHeader URI Values,"Submission MessageHeader URI Values","StructureDefinition/VRM-SubmissionHeader","Internal"
http://cdc.gov/nchs/nvss/fhir/vital-records-messaging/ValueSet/VRM-UpdateHeaderURI-vs,3.0.0-Preview1,draft,,UpdateURIVS,Update MessageHeader URI Values,"Update MessageHeader URI Values","StructureDefinition/VRM-UpdateHeader","Internal"
http://cdc.gov/nchs/nvss/fhir/vital-records-messaging/ValueSet/VRM-VOIDHeaderURI-vs,3.0.0-Preview1,draft,,VoidURIVS,Void MessageHeader URI Values,"Void MessageHeader URI Values","StructureDefinition/VRM-VoidHeader","Internal"
http://hl7.org/fhir/us/vr-common-library/ValueSet/ValueSet-jurisdiction-vr,2.0.0,active,,ValueSetJurisdictionVitalRecords,Value Set - Jurisdictions Vital Records,"This valueset contains the set of codes used to represent 2 Letter Codes for all 57 Jurisdictions Reporting Deaths to NCHS","StructureDefinition/VRM-StatusParameters,StructureDefinition/VRM-VoidParameters,StructureDefinition/VRM-AliasParameters,StructureDefinition/VRM-birth-record-identifier-child,StructureDefinition/VRM-MessageParameters,StructureDefinition/VRM-fetal-death-record-identifier","hl7.fhir.us.vr-common-library"
http://hl7.org/fhir/us/vrdr/ValueSet/vrdr-death-pregnancy-status-vs,3.0.0,active,"2.16.840.1.113883.4.642.40.10.48.8",DeathPregnancyStatusVS,Death Pregnancy Status ValueSet,"A set of codes that reflect whether the decedent was pregnant at or around the time of death. Based on [Pregnancy Status (NCHS)[2.16.840.1.114222.4.11.6003]](https://phinvads.cdc.gov/vads/ViewValueSet.action?oid=2.16.840.1.114222.4.11.6003).","StructureDefinition/VRM-RecentPregnancyParameters","THO (V3),hl7.fhir.us.vrdr"
